{
  "schema_version": "1.0",
  "effect_id": "cis-small-proposal-medium2k-p32-propbt16k-retrospective-v1",
  "analysis_mode": "retrospective_diagnostic",
  "baseline_configuration_id": "cis-small-proposal-medium2k-p32-policy-transfer-npu2-20260905-r1-fallback",
  "replay_control_configuration_id": "conditional-is-medium2k-p32-active-round-1-replay-control",
  "candidate_configuration_id": "conditional-is-medium2k-p32-mechanism-v1--9cd2964050c6eb47",
  "primary_metric": "completed_qps",
  "direction": "maximize",
  "algorithm_context_sha256": "d437fe8ed2abb2a0306a351e81ae76b9deb95098ba8005978cb54e71c7ac6837",
  "workload_context_sha256": "e06f1fc19b4f782505043d4bff691b4dfc0802a09dd42360af115bde09c5fc7c",
  "environment_context_sha256": "0390d2bedbac569c399d75b734cb416150b07db4f7f1d38aa0bb2b03e7bda195",
  "baseline_settings_sha256": "013d5ad59ca444dabc4c03eb4cea2ad62cae2f9d69e45a282c7b9dbd1c197986",
  "candidate_settings_sha256": "9f4057490c460b19d00a155e8af9d897ad9a8c50bbb5e333be2542a91c40341b",
  "lower_log_effect_bound": -0.2,
  "upper_log_effect_bound": 0.2,
  "confidence_alpha": 0.05,
  "confidence_method": "betting_mixture",
  "betting_fractions": [0.05, 0.1, 0.2, 0.4, 0.7, 0.9],
  "minimum_improvement_fraction": 0.03,
  "minimum_decision_pairs": 4,
  "maximum_pair_count": 20,
  "replication_batch_pairs": 2,
  "replication_seed_pool": [
    2026090607,
    2026090608,
    2026090609,
    2026090610,
    2026090611,
    2026090612,
    2026090613,
    2026090614,
    2026090615,
    2026090616,
    2026090617,
    2026090618,
    2026090619,
    2026090620,
    2026090621,
    2026090622,
    2026090623,
    2026090624,
    2026090625,
    2026090626
  ],
  "require_quality_constraints": true
}
